### ISSUE TITLE
Faild to push large layer

### ISSUE THREAD

**Issue by tclavier** [docker/docker-registry#419]
Hello 

Given a Dockerfile :

```
FROM ubuntu 
RUN dd if=/dev/urandom of=/huge.bin bs=100M count=20
```

and a local registry :

```
docker run -p 80:5000 registry
```

When i push my big layer, i have :  

```
# docker push localhost/big
The push refers to a repository [localhost/big] (len: 1)
Sending image list
Pushing repository localhost/big (1 tags)
511136ea3c5a: Image successfully pushed 
e465fff03bce: Image successfully pushed 
23f361102fae: Image successfully pushed 
9db365ecbcbb: Image successfully pushed 
ad892dd21d60: Image successfully pushed 
ba69850d526c: Pushing [=========================>                         ] 1.081 GB/2.097 GB 55s
2014/06/09 15:10:19 Failed to upload layer: Put http://localhost/v1/images/ba69850d526c1fd8490ad13e4663303e4be68d82af95191b49ee3ea125bf3b62/layer: read tcp 127.0.0.1:80: i/o timeout
```

last lines of tcpdump : 

```
15:27:22.985893 IP localhost.localdomain.47359 > localhost.localdomain.http: Flags [P.], seq 1072271530:1072300210, ack 1, win 342, options [nop,nop,TS val 46823747 ecr 46823743], length 28680
15:27:22.987077 IP localhost.localdomain.47359 > localhost.localdomain.http: Flags [F.], seq 1072300210, ack 1, win 342, options [nop,nop,TS val 46823747 ecr 46823743], length 0
15:27:22.987216 IP localhost.localdomain.http > localhost.localdomain.47359: Flags [.], ack 1072300211, win 23107, options [nop,nop,TS val 46823747 ecr 46823743], length 0
15:27:22.988644 IP localhost.localdomain.http > localhost.localdomain.47359: Flags [F.], seq 1, ack 1072300211, win 24576, options [nop,nop,TS val 46823748 ecr 46823743], length 0
15:27:22.988688 IP localhost.localdomain.47359 > localhost.localdomain.http: Flags [.], ack 2, win 342, options [nop,nop,TS val 46823748 ecr 46823748], length 0
```

It's impossible to push large layer :-(
